--
--Testing cms_topn_add function of the extension 
--
--check null cms_topn
SELECT cms_topn_add(NULL, 5);
 cms_topn_add 
--------------
 
(1 row)

--check null new item for different type of elements
CREATE TABLE add_test (
	cms_topn_column cms_topn
);
--fixed size type like integer
INSERT INTO add_test VALUES(cms_topn(3));
UPDATE add_test SET cms_topn_column = cms_topn_add(cms_topn_column, NULL::integer);
SELECT cms_topn_info(cms_topn_column) FROM add_test;
                    cms_topn_info                    
-----------------------------------------------------
 Sketch depth = 5, Sketch width = 2719, Size = 106kB
(1 row)

--variable length type like text
DELETE FROM add_test;
INSERT INTO add_test VALUES(cms_topn(3));
UPDATE add_test SET cms_topn_column = cms_topn_add(cms_topn_column, NULL::text);
SELECT cms_topn_info(cms_topn_column) FROM add_test;
                    cms_topn_info                    
-----------------------------------------------------
 Sketch depth = 5, Sketch width = 2719, Size = 106kB
(1 row)

--check type consistency
DELETE FROM add_test;
INSERT INTO add_test VALUES(cms_topn(2));
UPDATE add_test SET cms_topn_column = cms_topn_add(cms_topn_column, 'hello'::text);
UPDATE add_test SET cms_topn_column = cms_topn_add(cms_topn_column, 3);
ERROR:  not proper type for this cms_topn
--check normal insertion
--cidr
DELETE FROM add_test;
INSERT INTO add_test VALUES(cms_topn(2));
UPDATE add_test SET cms_topn_column = cms_topn_add(cms_topn_column, '192.168.100.128/25'::cidr);
UPDATE add_test SET cms_topn_column = cms_topn_add(cms_topn_column, NULL::cidr);
SELECT topn(cms_topn_column, NULL::cidr) from add_test;
          topn          
------------------------
 (192.168.100.128/25,1)
(1 row)

UPDATE add_test SET cms_topn_column = cms_topn_add(cms_topn_column, '192.168/24'::cidr);
UPDATE add_test SET cms_topn_column = cms_topn_add(cms_topn_column, '192.168/24'::cidr);
UPDATE add_test SET cms_topn_column = cms_topn_add(cms_topn_column, '192.168/24'::cidr);
SELECT topn(cms_topn_column, NULL::cidr) from add_test;
          topn          
------------------------
 (192.168.0.0/24,3)
 (192.168.100.128/25,1)
(2 rows)

UPDATE add_test SET cms_topn_column = cms_topn_add(cms_topn_column, '192.168/25'::cidr);
UPDATE add_test SET cms_topn_column = cms_topn_add(cms_topn_column, '192.168/25'::cidr);
UPDATE add_test SET cms_topn_column = cms_topn_add(cms_topn_column, '192.168/25'::cidr);
UPDATE add_test SET cms_topn_column = cms_topn_add(cms_topn_column, '192.168/25'::cidr);
SELECT topn(cms_topn_column, NULL::cidr) from add_test;
        topn        
--------------------
 (192.168.0.0/25,4)
 (192.168.0.0/24,3)
(2 rows)

UPDATE add_test SET cms_topn_column = cms_topn_add(cms_topn_column, '192.168.1'::cidr);
UPDATE add_test SET cms_topn_column = cms_topn_add(cms_topn_column, '192.168.1'::cidr);
UPDATE add_test SET cms_topn_column = cms_topn_add(cms_topn_column, '192.168.1'::cidr);
UPDATE add_test SET cms_topn_column = cms_topn_add(cms_topn_column, '192.168.1'::cidr);
UPDATE add_test SET cms_topn_column = cms_topn_add(cms_topn_column, '192.168.1'::cidr);
SELECT topn(cms_topn_column, NULL::cidr) from add_test;
        topn        
--------------------
 (192.168.1.0/24,5)
 (192.168.0.0/25,4)
(2 rows)

SELECT cms_topn_info(cms_topn_column) from add_test;
                    cms_topn_info                    
-----------------------------------------------------
 Sketch depth = 5, Sketch width = 2719, Size = 106kB
(1 row)

--inet
DELETE FROM add_test;
INSERT INTO add_test VALUES(cms_topn(2));
UPDATE add_test SET cms_topn_column = cms_topn_add(cms_topn_column, '192.168.100.128/25'::inet);
UPDATE add_test SET cms_topn_column = cms_topn_add(cms_topn_column, '192.168.100.128/25'::inet);
UPDATE add_test SET cms_topn_column = cms_topn_add(cms_topn_column, '192.168.100.128/25'::inet);
SELECT topn(cms_topn_column, NULL::inet) from add_test;
          topn          
------------------------
 (192.168.100.128/25,3)
(1 row)

UPDATE add_test SET cms_topn_column = cms_topn_add(cms_topn_column, '192.168.100.128/23'::inet);
SELECT topn(cms_topn_column, NULL::inet) from add_test;
          topn          
------------------------
 (192.168.100.128/25,3)
 (192.168.100.128/23,1)
(2 rows)

UPDATE add_test SET cms_topn_column = cms_topn_add(cms_topn_column, NULL::inet);
UPDATE add_test SET cms_topn_column = cms_topn_add(cms_topn_column, NULL::inet);
SELECT topn(cms_topn_column, NULL::inet) from add_test;
          topn          
------------------------
 (192.168.100.128/25,3)
 (192.168.100.128/23,1)
(2 rows)

UPDATE add_test SET cms_topn_column = cms_topn_add(cms_topn_column, '10.1.2.3/32'::inet);
UPDATE add_test SET cms_topn_column = cms_topn_add(cms_topn_column, '10.1.2.3/32'::inet);
UPDATE add_test SET cms_topn_column = cms_topn_add(cms_topn_column, '10.1.2.3/32'::inet);
UPDATE add_test SET cms_topn_column = cms_topn_add(cms_topn_column, '10.1.2.3/32'::inet);
SELECT topn(cms_topn_column, NULL::inet) from add_test;
          topn          
------------------------
 (10.1.2.3,4)
 (192.168.100.128/25,3)
(2 rows)

